{
  "AdBreaks": "example-value",
  "Arn": "arn:aws:service:us-east-1:123456789012:resource/example",
  "ChannelName": "example-resource",
  "ClipRange": "example-value",
  "CreationTime": "example-value",
  "DurationMillis": "example-value",
  "LiveSourceName": "example-resource",
  "ProgramName": "example-resource",
  "ScheduledStartTime": "example-value",
  "SourceLocationName": "example-resource",
  "VodSourceName": "example-resource"
}